{
  "regularHours": {
    "monday": {
      "open": "09:00",
      "close": "18:00",
      "closed": false
    },
    "tuesday": {
      "open": "09:00",
      "close": "18:00",
      "closed": false
    },
    "wednesday": {
      "open": "09:00",
      "close": "18:00",
      "closed": false
    },
    "thursday": {
      "open": "09:00",
      "close": "18:00",
      "closed": false
    },
    "friday": {
      "open": "09:00",
      "close": "18:00",
      "closed": false
    },
    "saturday": {
      "open": "10:00",
      "close": "16:00",
      "closed": false
    },
    "sunday": {
      "open": "",
      "close": "",
      "closed": true
    }
  },
  "specialHours": [
    {
      "date": "2024-12-25",
      "description": {
        "en": "Christmas Day",
        "fr": "Jour de Noël"
      },
      "closed": true
    },
    {
      "date": "2024-12-26",
      "description": {
        "en": "Boxing Day",
        "fr": "Lendemain de Noël"
      },
      "closed": true
    },
    {
      "date": "2025-01-01",
      "description": {
        "en": "New Year's Day",
        "fr": "Jour de l'An"
      },
      "closed": true
    }
  ],
  "timezone": "Europe/Zurich",
  "notes": {
    "en": "Hours may vary on public holidays. Please contact us to confirm.",
    "fr": "Les horaires peuvent varier les jours fériés. Veuillez nous contacter pour confirmer."
  }
}
